{
  "document_manifest": {
    "book_id": "ebs-2027-math1",
    "page_count": 1
  },
  "engine_manifest": {
    "general_ocr": {
      "engine_id": "paddleocr-vl",
      "engine_version": "3.7.0"
    },
    "pipeline": {
      "mode": "paddleocr_vl_baseline"
    },
    "problem_unit_detection": {
      "mode": "text_pattern_stem_and_answer_structure",
      "engine_id": "text-pattern-problem-unit-detector"
    }
  },
  "pages": [
    {
      "page_id": "p038",
      "page_geometry": {
        "width": 2434,
        "height": 3071
      },
      "nodes": [
        {
          "node_id": "p038-vl001",
          "bbox": {
            "x": 207.0,
            "y": 85.0,
            "width": 102.0,
            "height": 86.0
          },
          "normalized_bbox": {
            "x": 0.085045,
            "y": 0.027678,
            "width": 0.041906,
            "height": 0.028004
          },
          "reading_order_index": 0,
          "confidence": 1.0,
          "source_engine": "paddleocr-vl",
          "issues": [],
          "layout": {
            "vl_block_label": "header",
            "vl_block_id": 0
          },
          "content_type": "TEXT",
          "raw_text": "03",
          "normalized_text": "03",
          "spans": [
            {
              "span_type": "TEXT",
              "text": "03"
            }
          ]
        },
        {
          "node_id": "p038-vl002",
          "bbox": {
            "x": 343.0,
            "y": 106.0,
            "width": 177.0,
            "height": 60.0
          },
          "normalized_bbox": {
            "x": 0.14092,
            "y": 0.034516,
            "width": 0.07272,
            "height": 0.019538
          },
          "reading_order_index": 1,
          "confidence": 1.0,
          "source_engine": "paddleocr-vl",
          "issues": [],
          "layout": {
            "vl_block_label": "header",
            "vl_block_id": 1
          },
          "content_type": "TEXT",
          "raw_text": "삼각함수",
          "normalized_text": "삼각함수",
          "spans": [
            {
              "span_type": "TEXT",
              "text": "삼각함수"
            }
          ]
        },
        {
          "node_id": "p038-vl003",
          "bbox": {
            "x": 255.0,
            "y": 299.0,
            "width": 353.0,
            "height": 61.0
          },
          "normalized_bbox": {
            "x": 0.104766,
            "y": 0.097362,
            "width": 0.145029,
            "height": 0.019863
          },
          "reading_order_index": 2,
          "confidence": 1.0,
          "source_engine": "paddleocr-vl",
          "issues": [],
          "layout": {
            "vl_block_label": "paragraph_title",
            "vl_block_id": 2
          },
          "content_type": "TEXT",
          "raw_text": "2 삼각함수의 뜻",
          "normalized_text": "2 삼각함수의 뜻",
          "spans": [
            {
              "span_type": "TEXT",
              "text": "2 삼각함수의 뜻"
            }
          ]
        },
        {
          "node_id": "p038-vl004",
          "bbox": {
            "x": 254.0,
            "y": 398.0,
            "width": 1339.0,
            "height": 198.0
          },
          "normalized_bbox": {
            "x": 0.104355,
            "y": 0.129599,
            "width": 0.550123,
            "height": 0.064474
          },
          "reading_order_index": 3,
          "confidence": 1.0,
          "source_engine": "paddleocr-vl",
          "issues": [],
          "layout": {
            "vl_block_label": "text",
            "vl_block_id": 3
          },
          "content_type": "TEXT",
          "raw_text": "좌표평면에서 중심이 원점 O이고 반지름의 길이가 $r(r>0)$인 원 위의 한 점을 $\\mathrm{P}(x,y)$, $x$축의 양의 방향을 시초선으로 하였을 때, 동경 OP가 나타내는 각의 크기를 $\\theta$라 하자. 이때 $\\theta$에 대한 삼각함수를 다음과 같이 정의한다.",
          "normalized_text": "좌표평면에서 중심이 원점 O이고 반지름의 길이가 $r(r>0)$인 원 위의 한 점을 $\\mathrm{P}(x,y)$, $x$축의 양의 방향을 시초선으로 하였을 때, 동경 OP가 나타내는 각의 크기를 $\\theta$라 하자. 이때 $\\theta$에 대한 삼각함수를 다음과 같이 정의한다.",
          "spans": [
            {
              "span_type": "TEXT",
              "text": "좌표평면에서 중심이 원점 O이고 반지름의 길이가 "
            },
            {
              "span_type": "UNKNOWN",
              "text": "r(r>0)",
              "math_span_candidate": true,
              "presentation_ast": {
                "type": "Row",
                "children": [
                  {
                    "type": "Identifier",
                    "value": "r"
                  },
                  {
                    "type": "Parenthesized",
                    "body": {
                      "type": "Relation",
                      "operator": ">",
                      "left": {
                        "type": "Identifier",
                        "value": "r"
                      },
                      "right": {
                        "type": "Number",
                        "value": "0"
                      }
                    },
                    "delimiter": "("
                  }
                ]
              },
              "unconsumed_tokens": [],
              "ast_issues": []
            },
            {
              "span_type": "TEXT",
              "text": "인 원 위의 한 점을 "
            },
            {
              "span_type": "UNKNOWN",
              "text": "\\mathrm{P}(x,y)",
              "math_span_candidate": true,
              "presentation_ast": {
                "type": "Row",
                "children": [
                  {
                    "type": "Identifier",
                    "value": "P",
                    "decoration": "mathrm"
                  },
                  {
                    "type": "Parenthesized",
                    "body": {
                      "type": "Identifier",
                      "value": "x"
                    },
                    "delimiter": "("
                  }
                ]
              },
              "unconsumed_tokens": [
                ",",
                "y",
                ")"
              ],
              "ast_issues": [
                {
                  "code": "AST_UNMATCHED_PAREN",
                  "severity": "error",
                  "message": "Missing closing ')' for a parenthesized group."
                },
                {
                  "code": "AST_UNCONSUMED_TOKENS",
                  "severity": "warning",
                  "message": "3 token(s) left over after parsing: ',y)'"
                }
              ]
            },
            {
              "span_type": "TEXT",
              "text": ", "
            },
            {
              "span_type": "UNKNOWN",
              "text": "x",
              "math_span_candidate": true,
              "presentation_ast": {
                "type": "Identifier",
                "value": "x"
              },
              "unconsumed_tokens": [],
              "ast_issues": []
            },
            {
              "span_type": "TEXT",
              "text": "축의 양의 방향을 시초선으로 하였을 때, 동경 OP가 나타내는 각의 크기를 "
            },
            {
              "span_type": "UNKNOWN",
              "text": "\\theta",
              "math_span_candidate": true,
              "presentation_ast": {
                "type": "Identifier",
                "value": "θ"
              },
              "unconsumed_tokens": [],
              "ast_issues": []
            },
            {
              "span_type": "TEXT",
              "text": "라 하자. 이때 "
            },
            {
              "span_type": "UNKNOWN",
              "text": "\\theta",
              "math_span_candidate": true,
              "presentation_ast": {
                "type": "Identifier",
                "value": "θ"
              },
              "unconsumed_tokens": [],
              "ast_issues": []
            },
            {
              "span_type": "TEXT",
              "text": "에 대한 삼각함수를 다음과 같이 정의한다."
            }
          ]
        },
        {
          "node_id": "p038-vl005",
          "bbox": {
            "x": 332.0,
            "y": 614.0,
            "width": 730.0,
            "height": 84.0
          },
          "normalized_bbox": {
            "x": 0.136401,
            "y": 0.199935,
            "width": 0.299918,
            "height": 0.027353
          },
          "reading_order_index": 4,
          "confidence": 1.0,
          "source_engine": "paddleocr-vl",
          "issues": [
            {
              "code": "AST_UNCONSUMED_TOKENS",
              "severity": "warning",
              "message": "97 token(s) left over after parsing: '{begin{array}{l}frac{y}{r},costheta{begin{array}{l}frac{x}{r}end{array}},tantheta{begin{array}{l}frac{y}{x}end{array}}left(xneq0right)end{array}}'"
            }
          ],
          "layout": {
            "vl_block_label": "display_formula",
            "vl_block_id": 4
          },
          "content_type": "MATH",
          "raw_formula": "\\sin\\theta{\\begin{array}{l}\\frac{y}{r},\\cos\\theta{\\begin{array}{l}\\frac{x}{r}\\end{array}},\\tan\\theta{\\begin{array}{l}\\frac{y}{x}\\end{array}}\\left(x\\neq0\\right)\\end{array}}",
          "formula_format": "LATEX",
          "presentation_ast": {
            "type": "FunctionApplication",
            "name": "sin",
            "argument": {
              "type": "Identifier",
              "value": "θ"
            }
          },
          "unconsumed_tokens": [
            "{",
            "begin",
            "{",
            "a",
            "r",
            "r",
            "a",
            "y",
            "}",
            "{",
            "l",
            "}",
            "frac",
            "{",
            "y",
            "}",
            "{",
            "r",
            "}",
            ",",
            "cos",
            "theta",
            "{",
            "begin",
            "{",
            "a",
            "r",
            "r",
            "a",
            "y",
            "}",
            "{",
            "l",